{
  "role": "fixer",
  "status": "completed",
  "termination": "completed",
  "changed_files": ["evals/fixtures/sample_project.py"],
  "checks": [
    {
      "kind": "command",
      "criterion": "Known callers still return totals",
      "check": "python3 -c \"from evals.fixtures.sample_project import fleet_total; assert fleet_total([1,2,3,4]) == 10\"",
      "exit_code": 0,
      "result": "pass",
      "evidence": "exit 0: unrelated caller check passed"
    }
  ],
  "tool_failures": [],
  "blocker": null
}
